{
  "$schema": "https://json-schema.org/draft/2020-12/schema",
  "$id": "https://github.com/panel86/schema/layout-v1.schema.json",
  "title": "Panel 86 layout, версия 1",
  "description": "Раскладка одной панели. Лежит в LittleFS, редактируется в браузере, применяется без пересборки прошивки. Из этого же файла UI-VM выводит список подписок на сущности Home Assistant — отдельно их описывать не нужно.",
  "type": "object",
  "required": [
    "schema",
    "pages"
  ],
  "additionalProperties": false,
  "properties": {
    "schema": {
      "const": "panel86/1"
    },
    "room": {
      "type": "string",
      "description": "area_id комнаты, в которой висит панель. Определяет заголовок и контекст по умолчанию."
    },
    "revision": {
      "type": "integer",
      "minimum": 1,
      "description": "Растёт при каждом сохранении. Панель отклоняет раскладку с revision меньше текущей."
    },
    "theme": {
      "type": "object",
      "additionalProperties": false,
      "properties": {
        "accent": {
          "type": "string",
          "pattern": "^#[0-9a-fA-F]{6}$"
        },
        "scheme": {
          "enum": [
            "light",
            "dark",
            "auto"
          ],
          "default": "auto",
          "description": "auto — переключение по датчику освещённости."
        },
        "density": {
          "enum": [
            "compact",
            "comfortable"
          ],
          "default": "comfortable"
        },
        "radius": {
          "type": "integer",
          "minimum": 0,
          "maximum": 48,
          "default": 16,
          "description": "Скругление карточек. У «пузырей» ограничено половиной высоты."
        }
      }
    },
    "pages": {
      "type": "array",
      "minItems": 1,
      "maxItems": 8,
      "items": {
        "$ref": "#/$defs/page"
      }
    },
    "screensaver": {
      "type": "object",
      "additionalProperties": false,
      "properties": {
        "after": {
          "type": "string",
          "pattern": "^[0-9]+(s|min)$",
          "default": "60s"
        },
        "type": {
          "enum": [
            "clock",
            "clock_weather",
            "photo",
            "blank"
          ],
          "default": "clock_weather"
        },
        "brightness": {
          "type": "integer",
          "minimum": 0,
          "maximum": 100,
          "default": 12
        },
        "wake": {
          "type": "array",
          "items": {
            "enum": [
              "touch",
              "presence",
              "button"
            ]
          },
          "default": [
            "touch"
          ]
        },
        "weather_entity": {
          "type": "string"
        },
        "temperature_entity": {
          "type": "string"
        }
      }
    },
    "defaults": {
      "type": "object",
      "description": "Значения по умолчанию для всех карточек страницы. Перебиваются настройкой на самой карточке.",
      "additionalProperties": false,
      "properties": {
        "throttle": {
          "type": "string",
          "pattern": "^[0-9]+(ms|s)$",
          "default": "1s"
        },
        "deadband_percent": {
          "type": "number",
          "minimum": 0,
          "maximum": 100,
          "default": 0.5,
          "description": "Дедбенд в процентах от текущего значения — для датчиков, где абсолютный порог задавать неудобно."
        }
      }
    }
  },
  "$defs": {
    "page": {
      "type": "object",
      "required": [
        "id",
        "cards"
      ],
      "additionalProperties": false,
      "properties": {
        "id": {
          "type": "string",
          "pattern": "^[a-z0-9_]{1,24}$"
        },
        "title": {
          "type": "string",
          "maxLength": 24
        },
        "icon": {
          "type": "string"
        },
        "grid": {
          "type": "array",
          "items": {
            "type": "integer",
            "minimum": 1,
            "maximum": 4
          },
          "minItems": 2,
          "maxItems": 2,
          "default": [
            2,
            4
          ],
          "description": "[колонки, строки]. На 720x720 больше 2x4 нечитаемо пальцем."
        },
        "hidden": {
          "type": "boolean",
          "default": false
        },
        "cards": {
          "type": "array",
          "maxItems": 16,
          "items": {
            "$ref": "#/$defs/card"
          }
        }
      }
    },
    "card": {
      "type": "object",
      "required": [
        "type"
      ],
      "properties": {
        "type": {
          "enum": [
            "light",
            "switch",
            "climate",
            "cover",
            "valve",
            "fan",
            "scene",
            "script",
            "sensor",
            "binary_sensor",
            "media",
            "camera",
            "lock",
            "relay",
            "separator",
            "buttons",
            "room_grid",
            "spacer"
          ],
          "description": "Каталог намеренно закрытый. Одиннадцатый тип добавляется, когда трое попросят, а не когда одному захотелось."
        },
        "entity": {
          "type": "string",
          "pattern": "^[a-z_]+\\.[a-z0-9_]+$",
          "description": "entity_id в Home Assistant. Не нужен для relay, room_grid и spacer."
        },
        "label": {
          "type": "string",
          "maxLength": 20,
          "description": "Если не задан — берётся friendly_name из HA."
        },
        "icon": {
          "type": "string",
          "description": "Имя иконки Material Design Icons — то же, что в Home Assistant после «mdi:». Если не задано, подбирается по типу карточки."
        },
        "span": {
          "type": "array",
          "items": {
            "type": "integer",
            "minimum": 1,
            "maximum": 4
          },
          "minItems": 2,
          "maxItems": 2,
          "default": [
            1,
            1
          ]
        },
        "show_icon": {
          "type": "boolean",
          "default": true
        },
        "show_name": {
          "type": "boolean",
          "default": true
        },
        "show_state": {
          "type": "boolean",
          "default": true
        },
        "fill": {
          "type": "boolean",
          "default": true,
          "description": "У света: полоса на карточке показывает яркость."
        },
        "tap": {
          "enum": [
            "toggle",
            "none"
          ],
          "default": "toggle"
        },
        "sub_buttons": {
          "type": "array",
          "maxItems": 4,
          "description": "Маленькие круглые кнопки справа на карточке. Если ширины не хватает, панель убирает их по одной — имя важнее кнопок.",
          "items": {
            "type": "object",
            "required": [
              "service"
            ],
            "properties": {
              "icon": {
                "type": "string",
                "description": "Имя иконки Material Design Icons."
              },
              "service": {
                "type": "string",
                "description": "Действие Home Assistant. Можно писать {domain} — подставится домен сущности карточки, и одна кнопка «Включить» подойдёт и свету, и розетке."
              },
              "key": {
                "type": "string",
                "description": "Необязательный параметр действия, например hvac_mode."
              },
              "value": {
                "type": "string"
              }
            }
          }
        },
        "template": {
          "type": "object",
          "description": "Шаблоны Home Assistant. Вычисляет их HA, панель показывает результат. Все шаблоны раскладки уходят одним запросом раз в полминуты.",
          "additionalProperties": false,
          "properties": {
            "label": {
              "type": "string",
              "description": "Подпись карточки."
            },
            "state": {
              "type": "string",
              "description": "Вторая строка вместо состояния сущности."
            },
            "icon": {
              "type": "string",
              "description": "Должен вернуть имя иконки Material Design Icons."
            }
          }
        },
        "popup": {
          "type": "array",
          "maxItems": 6,
          "description": "Содержимое всплывающих подробностей. Если не задано, окно собирается по типу карточки: описывать руками каждое окно ради выключателя никто не станет.",
          "items": {
            "$ref": "#/$defs/popup_row"
          }
        }
      },
      "allOf": [
        {
          "if": {
            "properties": {
              "type": {
                "const": "relay"
              }
            }
          },
          "then": {
            "required": [
              "target"
            ],
            "properties": {
              "target": {
                "enum": [
                  "relay_1",
                  "relay_2"
                ]
              },
              "local_fallback": {
                "type": "boolean",
                "default": true,
                "description": "Касание переключает реле напрямую, минуя Home Assistant. Работает при мёртвом сервере и мёртвой сети. Отключать только осознанно."
              }
            }
          }
        },
        {
          "if": {
            "properties": {
              "type": {
                "const": "sensor"
              }
            }
          },
          "then": {
            "properties": {
              "unit": {
                "type": "string",
                "maxLength": 8
              },
              "decimals": {
                "type": "integer",
                "minimum": 0,
                "maximum": 3,
                "default": 1
              },
              "warn_above": {
                "type": "number"
              },
              "warn_below": {
                "type": "number"
              },
              "graph": {
                "type": "boolean",
                "default": false,
                "description": "Спарклайн за сутки. Требует запроса истории — дороже обычной подписки."
              },
              "deadband": {
                "type": "number",
                "minimum": 0,
                "description": "Не перерисовывать, пока значение не изменилось хотя бы на столько. Спасает от шума АЦП: замерено, что датчик напряжения шлёт обновление раз в 1,6 с, и 88 % изменений меньше 0,5 В. Без дедбенда карточка дёргается вечно и не даёт экрану уснуть."
              },
              "throttle": {
                "type": "string",
                "pattern": "^[0-9]+(ms|s)$",
                "default": "1s",
                "description": "Минимальный интервал между перерисовками карточки. Последнее значение всё равно дойдёт — просто не сразу."
              }
            }
          }
        },
        {
          "if": {
            "properties": {
              "type": {
                "const": "camera"
              }
            }
          },
          "then": {
            "properties": {
              "refresh": {
                "type": "string",
                "pattern": "^[0-9]+(s|min)$",
                "default": "10s",
                "description": "Снимки, не поток. JPEG раскодирует аппаратный блок P4."
              }
            }
          }
        },
        {
          "if": {
            "properties": {
              "type": {
                "const": "room_grid"
              }
            }
          },
          "then": {
            "required": [
              "areas"
            ],
            "properties": {
              "areas": {
                "type": "array",
                "items": {
                  "type": "string"
                },
                "maxItems": 12,
                "description": "Список area_id. Плитка комнат с переходом внутрь."
              }
            }
          }
        },
        {
          "if": {
            "properties": {
              "type": {
                "const": "buttons"
              }
            }
          },
          "then": {
            "required": [
              "buttons"
            ],
            "properties": {
              "buttons": {
                "type": "array",
                "maxItems": 5,
                "description": "Несколько сцен или сценариев в один ряд. По отдельной карточке на каждую сцену уходит вся страница, а нажимают их редко.",
                "items": {
                  "type": "object",
                  "required": [
                    "entity"
                  ],
                  "properties": {
                    "entity": {
                      "type": "string"
                    },
                    "label": {
                      "type": "string",
                      "maxLength": 16
                    }
                  }
                }
              }
            }
          }
        }
      ]
    },
    "popup_row": {
      "type": "object",
      "required": [
        "kind"
      ],
      "properties": {
        "kind": {
          "enum": [
            "pill",
            "slider",
            "buttons",
            "text"
          ],
          "description": "pill — плюс-минус со значением; slider — ползунок; buttons — ряд кнопок; text — только подпись."
        },
        "label": {
          "type": "string"
        },
        "service": {
          "type": "string",
          "description": "Можно писать {domain} — подставится домен сущности карточки."
        },
        "key": {
          "type": "string"
        },
        "min": {
          "type": "integer"
        },
        "max": {
          "type": "integer"
        },
        "step": {
          "type": "integer"
        },
        "buttons": {
          "type": "array",
          "maxItems": 4,
          "items": {
            "type": "object",
            "required": [
              "service"
            ],
            "properties": {
              "label": {
                "type": "string"
              },
              "service": {
                "type": "string"
              },
              "key": {
                "type": "string"
              },
              "value": {
                "type": "string"
              }
            }
          }
        }
      }
    }
  }
}